<?xml version="1.0" encoding="UTF-8"?>
<xs:schema xmlns:xs="http://www.w3.org/2001/XMLSchema">

    <xs:element name="Users">
        <xs:complexType>
            <xs:sequence>
                <xs:element name="User" maxOccurs="unbounded">
                    <xs:complexType>
                        <xs:sequence>
                            <xs:element name="ID" type="xs:integer"/>
                            <xs:element name="Type" type="xs:string"/>
                            <xs:element name="Login" type="xs:string"/>
                            <xs:element name="Password" type="xs:string"/>
                            <xs:element name="Name" type="xs:string"/>
                        </xs:sequence>
                    </xs:complexType>
                </xs:element>
            </xs:sequence>
        </xs:complexType>
    </xs:element>

</xs:schema>